{
  "created_at": "2026-08-05T06:02:00+00:00",
  "files": [
    {
      "columns": [
        "load_ohm",
        "vin_v",
        "iin_a",
        "vout_v",
        "iout_a"
      ],
      "path": "data/raw/buck-load-sweep.csv",
      "result": {
        "kind": "power_efficiency",
        "mean_efficiency_percent": 87.92794891,
        "observations": 10,
        "peak_efficiency_percent": 91.95507098,
        "peak_output_power_w": 3.589874635,
        "points": [
          {
            "efficiency_percent": 79.48531663,
            "input_power_w": 0.3158305052,
            "load_ohm": 100.0,
            "loss_w": 0.06479162814,
            "output_power_w": 0.251038877
          },
          {
            "efficiency_percent": 81.73145365,
            "input_power_w": 0.453660555,
            "load_ohm": 68.0,
            "loss_w": 0.08287718875,
            "output_power_w": 0.3707833663
          },
          {
            "efficiency_percent": 84.19382636,
            "input_power_w": 0.6360608698,
            "load_ohm": 47.0,
            "loss_w": 0.1005368855,
            "output_power_w": 0.5355239843
          },
          {
            "efficiency_percent": 86.61408594,
            "input_power_w": 0.8719215725,
            "load_ohm": 33.0,
            "loss_w": 0.1167146724,
            "output_power_w": 0.7552069001
          },
          {
            "efficiency_percent": 89.12950653,
            "input_power_w": 1.269595821,
            "load_ohm": 22.0,
            "loss_w": 0.1380113308,
            "output_power_w": 1.13158449
          },
          {
            "efficiency_percent": 90.81111042,
            "input_power_w": 1.826899556,
            "load_ohm": 15.0,
            "loss_w": 0.167871783,
            "output_power_w": 1.659027773
          },
          {
            "efficiency_percent": 91.69551175,
            "input_power_w": 2.683350718,
            "load_ohm": 10.0,
            "loss_w": 0.2228385451,
            "output_power_w": 2.460512173
          },
          {
            "efficiency_percent": 91.87683469,
            "input_power_w": 3.262954723,
            "load_ohm": 8.2,
            "loss_w": 0.2650552062,
            "output_power_w": 2.997899517
          },
          {
            "efficiency_percent": 91.95507098,
            "input_power_w": 3.903944173,
            "load_ohm": 6.8,
            "loss_w": 0.3140695375,
            "output_power_w": 3.589874635
          },
          {
            "efficiency_percent": 91.78677216,
            "input_power_w": 4.707216563,
            "load_ohm": 5.6,
            "loss_w": 0.3866144212,
            "output_power_w": 4.320602142
          }
        ]
      }
    }
  ],
  "run_id": "buck-load-001",
  "schema": "benchlineage/analysis/v1",
  "study_id": "buck-efficiency",
  "uncertainty_budget": {
    "combined_standard_uncertainty": 0.004618802154,
    "components": [
      {
        "contribution": 0.003464101615,
        "distribution": "rectangular",
        "name": "voltage channels",
        "sensitivity": 1.0,
        "source": "synthetic calibration certificate",
        "standard_uncertainty": 0.003464101615,
        "variance_share": 0.5625
      },
      {
        "contribution": 0.002309401077,
        "distribution": "rectangular",
        "name": "current channels",
        "sensitivity": 1.0,
        "source": "synthetic calibration certificate",
        "standard_uncertainty": 0.002309401077,
        "variance_share": 0.25
      },
      {
        "contribution": 0.002,
        "distribution": "normal",
        "name": "load temperature drift",
        "sensitivity": 1.0,
        "source": "stability window",
        "standard_uncertainty": 0.002,
        "variance_share": 0.1875
      }
    ],
    "coverage_factor": 2.0,
    "expanded_uncertainty": 0.009237604307
  }
}
