{
  "created_at": "2026-08-04T06:02:00+00:00",
  "files": [
    {
      "columns": [
        "frequency_hz",
        "vin_v",
        "vout_v",
        "phase_deg"
      ],
      "path": "data/raw/rc-baseline.csv",
      "result": {
        "cutoff_frequency_hz": 1574.890393,
        "cutoff_target_db": -2.996139211,
        "kind": "frequency_response",
        "observations": 41,
        "passband_gain_db": 0.01416074531,
        "peak_gain": 1.006712044,
        "points": [
          {
            "frequency_hz": 20.0,
            "gain": 1.004324928,
            "gain_db": 0.03748484727,
            "phase_deg": -0.75311
          },
          {
            "frequency_hz": 24.745957,
            "gain": 1.006712044,
            "gain_db": 0.05810529154,
            "phase_deg": -0.58527
          },
          {
            "frequency_hz": 30.618118,
            "gain": 1.000877944,
            "gain_db": 0.007622381401,
            "phase_deg": -1.23193
          },
          {
            "frequency_hz": 37.883731,
            "gain": 0.997085498,
            "gain_db": -0.02535200463,
            "phase_deg": -1.44266
          },
          {
            "frequency_hz": 46.873458,
            "gain": 0.9991878871,
            "gain_db": -0.007056789023,
            "phase_deg": -1.85249
          },
          {
            "frequency_hz": 57.996428,
            "gain": 1.004540288,
            "gain_db": 0.03934718101,
            "phase_deg": -2.14169
          },
          {
            "frequency_hz": 71.758854,
            "gain": 1.001010206,
            "gain_db": 0.008770107159,
            "phase_deg": -2.2777
          },
          {
            "frequency_hz": 88.787075,
            "gain": 1.000614737,
            "gain_db": 0.005337897041,
            "phase_deg": -2.97065
          },
          {
            "frequency_hz": 109.856054,
            "gain": 0.999963488,
            "gain_db": -0.0003171451639,
            "phase_deg": -3.81709
          },
          {
            "frequency_hz": 135.924657,
            "gain": 1.002498589,
            "gain_db": 0.02167540304,
            "phase_deg": -4.85592
          },
          {
            "frequency_hz": 168.179283,
            "gain": 0.9934179948,
            "gain_db": -0.05735954912,
            "phase_deg": -5.87784
          },
          {
            "frequency_hz": 208.087861,
            "gain": 0.9941435241,
            "gain_db": -0.05101824349,
            "phase_deg": -7.30759
          },
          {
            "frequency_hz": 257.466659,
            "gain": 0.9899023849,
            "gain_db": -0.08815258869,
            "phase_deg": -9.31748
          },
          {
            "frequency_hz": 318.562937,
            "gain": 0.9803766549,
            "gain_db": -0.1721407774,
            "phase_deg": -11.37784
          },
          {
            "frequency_hz": 394.15723,
            "gain": 0.9681937414,
            "gain_db": -0.2807545808,
            "phase_deg": -13.81763
          },
          {
            "frequency_hz": 487.689884,
            "gain": 0.9553867474,
            "gain_db": -0.3964157459,
            "phase_deg": -17.2453
          },
          {
            "frequency_hz": 603.417634,
            "gain": 0.930684376,
            "gain_db": -0.6239515363,
            "phase_deg": -20.69446
          },
          {
            "frequency_hz": 746.607327,
            "gain": 0.9045426565,
            "gain_db": -0.8714189561,
            "phase_deg": -25.24073
          },
          {
            "frequency_hz": 923.775623,
            "gain": 0.864395605,
            "gain_db": -1.265748999,
            "phase_deg": -30.20492
          },
          {
            "frequency_hz": 1142.98557,
            "gain": 0.8104102293,
            "gain_db": -1.825901715,
            "phase_deg": -35.79753
          },
          {
            "frequency_hz": 1414.213562,
            "gain": 0.7503728016,
            "gain_db": -2.49445832,
            "phase_deg": -41.66717
          },
          {
            "frequency_hz": 1749.803367,
            "gain": 0.6693354081,
            "gain_db": -3.487124001,
            "phase_deg": -47.57082
          },
          {
            "frequency_hz": 2165.027904,
            "gain": 0.5929746094,
            "gain_db": -4.539278046,
            "phase_deg": -53.8345
          },
          {
            "frequency_hz": 2678.78432,
            "gain": 0.509442588,
            "gain_db": -5.858095041,
            "phase_deg": -59.406
          },
          {
            "frequency_hz": 3314.454017,
            "gain": 0.4331640437,
            "gain_db": -7.266952014,
            "phase_deg": -64.13084
          },
          {
            "frequency_hz": 4100.966752,
            "gain": 0.3626423946,
            "gain_db": -8.810428523,
            "phase_deg": -69.03083
          },
          {
            "frequency_hz": 5074.11725,
            "gain": 0.2986794424,
            "gain_db": -10.49589336,
            "phase_deg": -72.59166
          },
          {
            "frequency_hz": 6278.194247,
            "gain": 0.2451697486,
            "gain_db": -12.21066237,
            "phase_deg": -76.00593
          },
          {
            "frequency_hz": 7767.996097,
            "gain": 0.2000866409,
            "gain_db": -13.97563813,
            "phase_deg": -78.66208
          },
          {
            "frequency_hz": 9611.324689,
            "gain": 0.163523264,
            "gain_db": -15.72840906,
            "phase_deg": -80.56126
          },
          {
            "frequency_hz": 11892.07115,
            "gain": 0.1324577063,
            "gain_db": -17.55845539,
            "phase_deg": -82.3969
          },
          {
            "frequency_hz": 14714.03379,
            "gain": 0.1078407535,
            "gain_db": -19.34434172,
            "phase_deg": -84.19196
          },
          {
            "frequency_hz": 18205.64203,
            "gain": 0.08698019319,
            "gain_db": -21.21159264,
            "phase_deg": -85.06792
          },
          {
            "frequency_hz": 22525.80132,
            "gain": 0.07043120132,
            "gain_db": -23.04469808,
            "phase_deg": -86.01381
          },
          {
            "frequency_hz": 27871.12502,
            "gain": 0.0572372973,
            "gain_db": -24.84641763,
            "phase_deg": -86.76804
          },
          {
            "frequency_hz": 34484.88241,
            "gain": 0.04620284777,
            "gain_db": -26.70662511,
            "phase_deg": -87.47746
          },
          {
            "frequency_hz": 42668.07006,
            "gain": 0.03710284242,
            "gain_db": -28.61185636,
            "phase_deg": -87.81548
          },
          {
            "frequency_hz": 52793.11036,
            "gain": 0.03021192484,
            "gain_db": -30.39643209,
            "phase_deg": -88.46311
          },
          {
            "frequency_hz": 65320.80072,
            "gain": 0.02435087684,
            "gain_db": -32.26970792,
            "phase_deg": -88.60067
          },
          {
            "frequency_hz": 80821.28477,
            "gain": 0.01974861249,
            "gain_db": -34.08926824,
            "phase_deg": -88.77507
          },
          {
            "frequency_hz": 100000.0,
            "gain": 0.01583490187,
            "gain_db": -36.00769247,
            "phase_deg": -89.1311
          }
        ]
      }
    }
  ],
  "run_id": "rc-baseline-001",
  "schema": "benchlineage/analysis/v1",
  "study_id": "rc-filter",
  "uncertainty_budget": {
    "combined_standard_uncertainty": 0.0033326666,
    "components": [
      {
        "contribution": 0.002886751346,
        "distribution": "rectangular",
        "name": "oscilloscope vertical accuracy",
        "sensitivity": 1.0,
        "source": "synthetic calibration certificate",
        "standard_uncertainty": 0.002886751346,
        "variance_share": 0.75030012
      },
      {
        "contribution": 0.0016,
        "distribution": "normal",
        "name": "repeatability",
        "sensitivity": 1.0,
        "source": "repeat sweep summary",
        "standard_uncertainty": 0.0016,
        "variance_share": 0.2304921969
      },
      {
        "contribution": 0.0004618802154,
        "distribution": "rectangular",
        "name": "frequency timebase",
        "sensitivity": 1.0,
        "source": "synthetic instrument specification",
        "standard_uncertainty": 0.0004618802154,
        "variance_share": 0.01920768307
      }
    ],
    "coverage_factor": 2.0,
    "expanded_uncertainty": 0.0066653332
  }
}
